task,model,rank,selected_for_goal1,evidence_score,goal1_fit_score,integration_score,calibration_score,rationale,limitation,source,total_score
biosignal_wearable,BIOT,1,True,5,5,4,3,"Best for heterogeneous wearable/BCI streams because it was built for mismatched channels, variable lengths, and missing biosignal values.",Does not directly solve glucose forecasting or EHR timeline modeling.,https://papers.neurips.cc/paper_files/paper/2023/hash/f6b30f3e2dd9cb53bbf2024402d02295-Abstract-Conference.html,17
cgm_glucose,GluFormer,1,True,5,5,2,3,Transformer foundation model trained on large-scale CGM data; the strongest fit for glucose forecasting when weights/data access are available.,Weights/data access are gated; not guaranteed reproducible without the source cohort.,https://www.nature.com/articles/s41586-025-09925-9,15
cgm_glucose,Conformalized Ridge baseline,2,True,3,4,5,5,Always-runnable forecasting baseline in this repo: split-conformal prediction intervals give distribution-free coverage when GluFormer access is unavailable.,Linear baseline; lower ceiling than a CGM foundation model on long-horizon dynamics.,https://arxiv.org/abs/2107.07511,17
eeg_bci,EEG-X,1,True,5,5,3,3,"Best fit for Galea/EMOTIV because it is designed for varying channel counts, channel combinations, recording lengths, and noisy cross-device EEG.",Recent preprint; integration depends on released weights/code maturity.,https://arxiv.org/abs/2511.08861,16
ehr_timeline,Med-BERT / BEHRT,1,True,5,4,4,3,Established transformer encoders for structured EHR code sequences; best fit for the MIMIC-IV demo concept timelines used in Goal 1.,Structured-code focus; does not model free-text notes directly.,https://arxiv.org/abs/1904.05342,16
wearable_llm_insight,PHIA,1,True,4,5,4,2,LLM agent with code execution and retrieval over wearable time-series questions; best reference for turning deterministic model outputs into explainable insights.,"Agent layer should explain, not replace, the deterministic signal pipeline.",https://pmc.ncbi.nlm.nih.gov/articles/PMC12855967/,15
